Entity,IRI
Left temporal bone,fma.fma52739
Right fifth anterior intercostal vein,fma.fma4777
Left pre-optic artery,fma.fma50320
Brodmann area 6 of left superior frontal gyrus,fma.fma271876
Tarsal plate of right lower eyelid,fma.fma59089
Right superior laryngeal artery,fma.fma49481
Vasculature of periosteum of left lacrimal bone,fma.fma315431
Occipital condyle,fma.fma52861
Skin of right temporal part proper of head,fma.fma317823
Right pterygoid fossa,fma.fma84971
Internal axis of eyeball,fma.fma58293
Vasculature of tongue,fma.fma260146
Integument of subdivision of head,fma.fma224058
Temporal region of subarachnoid space,fma.fma0327229
Epimysium of occipitalis,fma.fma319355
Choroidal branch of left posterior inferior cerebellar artery to fourth ventricle,fma.fma50530
Meningeal branch of left occipital artery,fma.fma49620
Branch of anterior choroidal artery to fimbria of hippocampus,fma.fma50130
Neck of left malleus,fma.fma270049
Right stylohyal,fma.fma56473
Neuronal component of gray matter of midbrain,fma.fma268618
Sternocleidomastoid branch of occipital branch of right posterior auricular artery,fma.fma79402
Bony part of right palatine bone,fma.fma259755
Endosteum of maxilla,fma.fma314985
Inferior central retinal artery,fma.fma51940
Left superior cerebellar vein,fma.fma52476
Optic nerve,fma.fma50863
Sublentiform nucleus,fma.fma72404
Left cerebral hemisphere,fma.fma61819
Right parietal tuber,fma.fma57081
Pre-auricular part of cheek,fma.fma61564
Trunk of left deep lingual vein,fma.fma80503
Auricular cartilage,fma.fma61013
Gray matter of temporal segment of left fusiform gyrus,fma.fma274877
Left sternocleidomastoid artery,fma.fma49479
Tributary of inferior cerebral vein,fma.fma0327017
Subdivision of subclavian vein,fma.fma77884
Neural network of soft palate,fma.fma270149
Trunk of tributary of pterygoid plexus,fma.fma78179
Trunk of vena comitantes of internal thoracic artery,fma.fma78130
Muscle body of left orbicularis oculi,fma.fma320384
Posterior limb of stapes,fma.fma52768
Oral orifice,fma.fma59806
Humor of left vitreous body,fma.fma261238
Superficial fascia of cheek,fma.fma57801
Middle temporal gyrus,fma.fma61906
Region of surface of eyeball,fma.fma65540
Left sternocleidomastoid vein,fma.fma50815
Trunk of tributary of internal thoracic vein,fma.fma78129
Vasculature of metencephalon,fma.fma268515
Nucleus of right lens,fma.fma58972
Right central retinal artery,fma.fma49880
Pontocerebellar cistern,fma.fma83725
Choroid,fma.fma58298
Medulla part of central canal,fma.fma268183
Tensor tympani,fma.fma49028
Brodmann area 6 of right inferior frontal gyrus,fma.fma271637
Lateral cerebellomedullary cistern,fma.fma83722
Neural network of occipital bone,fma.fma314883
Buccal part of right masseter,fma.fma314144
Lower lip proper,fma.fma59831
Set of mandibular periodontia,fma.fma269572
Mandibular alveolodental arch,fma.fma289649
Superficial fascia of left upper eyelid,fma.fma223071
Right temporal fossa,fma.fma314559
Zone of hyoid bone,fma.fma59494
Retro-olivary sulcus of medulla oblongata,fma.fma83796
Nucleus of left lens,fma.fma58973
Buccal fat pad,fma.fma59799
Right external ear,fma.fma53643
Right orbicularis oculi,fma.fma46792
Muscle body of right occipitalis,fma.fma318366
Trunk of sublingual vein,fma.fma80495
Orbital cavity proper,fma.fma0329312
Posterior part of right superior frontal gyrus,fma.fma72766
Brodmann area 43 of left precentral gyrus,fma.fma271585
Triangular part of right inferior frontal gyrus,fma.fma72750
First part of right subclavian artery proper,fma.fma3955
Trunk of left fourth anterior intercostal vein,fma.fma78166
Skin of left temporal part proper of head,fma.fma317825
Posterior meningeal artery,fma.fma49503
Alar branch of right superior labial artery,fma.fma49578
Lumen of trunk of right common carotid artery,fma.fma262453
Left anterior subcentral sulcus,fma.fma275355
Trunk of tributary of superior systemic venous tree,fma.fma45849
Skeleton of nasal septum,fma.fma60118
Plica semilunaris of right conjunctiva,fma.fma59046
Left side of hard palate,fma.fma293375
Peritrigeminal nucleus,fma.fma72600
Foramen cecum posterior,fma.fma75265
Tragal part of auricular cartilage,fma.fma61347
Muscle body of frontalis,fma.fma318358
Median callosal artery,fma.fma50175
Pericranial tributary of superior sagittal sinus,fma.fma51225
Parietal branch of middle meningeal artery,fma.fma49718
Superficial fascia of infra-orbital part of cheek,fma.fma86608
Trunk of right anterior choroidal artery,fma.fma76254
Endosteum of sphenoid,fma.fma315014
Branch of inferior hypophyseal artery,fma.fma66312
Space of arachnoid granulation,fma.fma266087
Palatine part of left palatoglossus,fma.fma60018
Right thalamotuberal artery,fma.fma50425
Bony part of sphenoid bone,fma.fma259767
Skeletal muscle tissue of left occipitalis,fma.fma318380
Paramedian medullary reticular complex,fma.fma72580
Right superior ophthalmic vein,fma.fma51248
Superficial fascia of right temple,fma.fma320497
Gray matter of posterior segment of right paracentral lobule,fma.fma273847
Right tympanic meatal wall,fma.fma314611
Posterior cerebellar lobe fissure,fma.fma0327492
Branch of left anterior choroidal artery to left hippocampus,fma.fma50155
Vasculature of periosteum of left inferior nasal concha,fma.fma315515
Belly of right nasalis,fma.fma314483
Vein of right pterygoid canal,fma.fma50971
Deep fascial system of face,fma.fma270177
Right frontalis,fma.fma46759
Subdivision of petrous part of internal carotid artery,fma.fma70521
Right auricularis anterior,fma.fma48959
Tributary of retromandibular vein,fma.fma50931
Right lesser horn,fma.fma59500
Muscle body of tragicus,fma.fma318552
Transverse part of nasalis,fma.fma46772
Neuroglial network,fma.fma267198
Suspensory ligament of left lens,fma.fma58840
Crista galli,fma.fma57442
Reticular formation,fma.fma77719
Anastomotic branch of middle meningeal artery with lacrimal artery,fma.fma49733
Aqueous chamber of eyeball,fma.fma321530
Network of trabecular spaces in bone tissue of left nasal bone,fma.fma259413
Virchow-Robin space,fma.fma259413
Segment of skin of mouth,fma.fma59355
Cuneate fasciculus of medulla,fma.fma72623
Right superior temporal sulcus,fma.fma275421
Right tenth anterior intercostal vein,fma.fma71204
Peripharyngeal compartment,fma.fma55079
Medullary cavity of left nasal bone,fma.fma314762
Brodmann area 18 of cuneus,fma.fma271460
Superior ligament of left pinna,fma.fma61042
Lateral glandular branch of right superior thyroid artery,fma.fma49495
Right auriculotemporal part of head,fma.fma320455
Superficial fascia of buccal part of mouth,fma.fma86614
Skin of right temporal part of head,fma.fma52922
Right uncal artery,fma.fma50091
Superior cerebellar artery,fma.fma50573
Right ascending pharyngeal artery,fma.fma49498
Precuneus,fma.fma61900
Conchal part of right auricular cartilage,fma.fma61351
Articular tributary of left pterygoid plexus,fma.fma50966
Skin of left lower eyelid,fma.fma52920
Facial modiolus,fma.fma46837
Superior petrosal sinus,fma.fma50771
Lobe of cerebral hemisphere,fma.fma61823
Skin of temple region of temporal part of head,fma.fma317827
Vasculature of floor of mouth,fma.fma286278
Set of subarachnoid incisures,fma.fma77869
Left cingulate sulcus proper,fma.fma275261
Mucosa of right side of nasal septum,fma.fma60114
Zone of body of mandible,fma.fma59425
Distal zone of superficial part of masseter,fma.fma319284
Medial region of ramus proper of mandible,fma.fma318889
Right lesser wing of sphenoid,fma.fma53653
Dorsal intermediate sulcus of spinal cord,fma.fma83799
Superficial fascia of right mandibular part proper of mouth,fma.fma289636
Sub-zygomatic arch space,fma.fma316315
Glandular branch of inferior labial artery,fma.fma296698
Orbicularis oris,fma.fma46841
Set of subarachnoid spaces,fma.fma74607
Alveolar part of maxilla,fma.fma52897
Cheek proper,fma.fma46488
Brain,fma.fma50801
Subdivision of skull,fma.fma54964
Orbital part of left lacrimal bone,fma.fma57618
Frontal part of head,fma.fma46448
Brodmann area 4 of left middle frontal gyrus,fma.fma271902
Superficial fascia of face,fma.fma57796
Trunk of esophageal tributary of inferior thyroid vein,fma.fma78125
Left anterolateral pontine vein,fma.fma51636
Medial striate branch of middle cerebral artery,fma.fma50430
Left nasolacrimal duct,fma.fma59556
Cortex of right frontal lobe,fma.fma242207
Superficial fascia of parietal part of head,fma.fma86598
Supratrochlear vein,fma.fma50898
Left lateral orbital gyrus,fma.fma72757
Superficial fascia of mouth,fma.fma57804
Medial frontal gyrus,fma.fma273103
Terminal branch of superficial temporal artery,fma.fma79422
Squamous part of occipital bone,fma.fma52860
Musculature of mouth,fma.fma55601
White matter of left lateral orbital gyrus,fma.fma270973
Posterior ascending limb of left lateral sulcus,fma.fma275337
White matter of inferior frontal gyrus,fma.fma270927
Vasculature of telencephalon,fma.fma268509
Helicis major,fma.fma48968
Falx cerebri,fma.fma83967
Periosteum of right maxilla,fma.fma259813
Superior occipital gyrus,fma.fma61901
Stroma of left iris,fma.fma58528
Prefrontal artery,fma.fma50437
Trunk of right eleventh anterior intercostal vein,fma.fma78151
External acoustic tube,fma.fma61734
Right lateral half of external nose,fma.fma0326695
Articular disk of left temporomandibular joint,fma.fma57061
Trunk of right facial artery,fma.fma66450
Segment of lateral occipital gyrus,fma.fma274235
Integument of lip,fma.fma224146
Tarsal plate of upper eyelid,fma.fma59087
Left infra-orbital artery,fma.fma49769
Wall of external part of external acoustic tube,fma.fma61328
Superficial fascia of orbital part of face,fma.fma269983
Left oculomotor sulcus,fma.fma275467
Trunk of right vertebral artery,fma.fma76261
Medial branch of inferior hypophyseal artery,fma.fma49853
Tributary of left inferior petrosal sinus from pons,fma.fma52480
Zone of cranial cavity,fma.fma322221
Mastoid branch of posterior tympanic artery,fma.fma49635
Pharyngotympanic part of left temporal bone,fma.fma285207
Crus of helical part of right auricular cartilage,fma.fma320959
Right angular vein,fma.fma50895
Posterior temporal branch of left middle cerebral artery,fma.fma50471
Left palatomaxillary suture,fma.fma53012
Submucosa of palate,fma.fma228613
Medullary cavity of left maxilla,fma.fma314756
Skin of head proper,fma.fma59343
Horizontal plate of left palatine bone,fma.fma59140
Quadrilateral part of right sphenoidal concha,fma.fma54926
Articular cartilage of left head of mandible,fma.fma57095
Mammary tributary of right internal thoracic vein,fma.fma73215
Zone of lacrimal gland,fma.fma59381
Subdural space of neuraxis,fma.fma322070
Right side of chin,fma.fma225806
Left common carotid artery,fma.fma4058
Anteroventral cochlear nucleus,fma.fma72571
Neural network of frontal part of head,fma.fma270093
Superior segment of lingual gyrus,fma.fma274610
Ventral part of of left lateral occipital gyrus,fma.fma274247
Branch of right anterior choroidal artery to right anterior perforated substance,fma.fma50134
Right inferior transverse frontopolar gyrus,fma.fma274416
Skeletal muscle tissue of right occipitalis,fma.fma318378
Roof of left side of internal nose,fma.fma59751
Left maxillary artery,fma.fma49677
Philtrum proper,fma.fma281717
Mucosa of left incus,fma.fma302793
Posterior ligament of pinna,fma.fma61038
Tarsal muscle,fma.fma320407
Right splenial artery,fma.fma50684
Muscle body of antitragicus,fma.fma318558
Frontal horn of left lateral ventricle,fma.fma242362
Meningeal branch of ascending pharyngeal artery,fma.fma49523
Descending process of left lacrimal bone,fma.fma57624
Gray matter of right cuneus,fma.fma270628
Frontal tuber,fma.fma52852
Anterior ligament of right pinna,fma.fma61043
Maxillary process of zygomatic bone,fma.fma289670
Integument of temporal part of head,fma.fma224168
Head region of masseter,fma.fma319271
Postcentral gyrus,fma.fma61896
Left terminal sulcus,fma.fma275463
Trunk of posterior choroidal artery,fma.fma86129
Tongue,fma.fma54640
Zygomatic part of left cheek,fma.fma60968
Left seventh anterior intercostal vein,fma.fma4787
Plica semilunaris of conjunctiva,fma.fma59045
Branch of superior labial artery,fma.fma49574
Left medial occipital artery,fma.fma50646
Right lateral pontine vein,fma.fma51357
Right lateral segment of maxillary alveolodental arch,fma.fma289721
Linear nucleus,fma.fma72436
Submucosa of left retromolar region,fma.fma314074
Cerebral segment of dura mater,fma.fma266065
Central sulcus,fma.fma83752
Lobe of left submandibular gland,fma.fma60046
Anterior temporal branch of middle cerebral artery,fma.fma50465
Right parietal emissary vein,fma.fma52003
Inferior vestibular nucleus,fma.fma54608
Anterior part of right superior frontal gyrus,fma.fma72762
Supporting cell of olfactory epithelium,fma.fma62302
Left lateral nasal cartilage,fma.fma59513
Olivary pretectal nucleus,fma.fma72405
Neural network of nasal bone,fma.fma314899
Perpendicular plate of left palatine bone,fma.fma59136
Vasculature of zygomatic part of cheek,fma.fma314200
Basilic vein,fma.fma22908
Right dorsal nasal artery,fma.fma50001
Precentral vein of cerebellum,fma.fma0329305
Muscular branch of posterior auricular artery,fma.fma79411
Trunk of right second anterior intercostal vein,fma.fma78169
Right occipital condyle,fma.fma52862
Central part of oculomotor nerve,fma.fma72457
Right anterior occipital sulcus,fma.fma275433
Rhinal sulcus,fma.fma83746
Os incisivum segment of left maxilla,fma.fma295984
Septum of internal nose,fma.fma59665
Medial wall of right orbit,fma.fma53090
Mucosa of oral segment of left side of hard palate,fma.fma289683
Right intralingual sulcus,fma.fma275453
Trunk of left anterior choroidal artery,fma.fma76255
Vermilion of left side of upper lip,fma.fma305950
Branch of superior cerebellar artery,fma.fma50576
External part of left external acoustic tube,fma.fma61313
Trunk of tributary of facial vein,fma.fma77960
Suprasellar part of cranial cavity,fma.fma322222
Gray matter of left superior occipital gyrus,fma.fma270618
Principal pretectal nucleus,fma.fma72402
Orbital part of right zygomatic bone,fma.fma317181
Anterior part of zygomatic process of left temporal bone,fma.fma55437
Trunk of pontine artery,fma.fma76649
Lateral branch of pontine artery,fma.fma50565
Right great cerebral vein,fma.fma50994
Left lateral half of external nose,fma.fma0326694
Deep layer of left levator palpebrae superioris,fma.fma49142
Segment of vertebral artery,fma.fma50492
Oral conduit,fma.fma265134
Anterior auricular branch of left superficial temporal artery,fma.fma49662
Incisive fossa segment of palatine process of right maxilla,fma.fma296005
Atrium of lateral ventricle,fma.fma83704
Inferior labial vein,fma.fma52541
Orbital part of right medial frontal gyrus,fma.fma276594
Right superior pontine sulcus,fma.fma275315
Right inferior postcentral sulcus,fma.fma275393
Left tonsillar artery,fma.fma49560
Dental branch of right posterior superior alveolar artery,fma.fma49762
Brodmann area 17 of lingual gyrus,fma.fma271389
Cavity of fourth ventricle,fma.fma242761
Posterior pole of right eyeball,fma.fma58117
Brodmann area 46 of right inferior frontal gyrus,fma.fma271492
Musculature of tongue,fma.fma71289
Sublingual nucleus,fma.fma68574
Brachial vein,fma.fma22934
Left auriculotemporal part of head,fma.fma320457
Neural network of sphenoid bone,fma.fma314908
Superficial part of left parotid gland,fma.fma59811
Obverse part of pinna,fma.fma0326537
Left dorsal intermediate sulcus of spinal cord,fma.fma275513
Confluence of sinuses,fma.fma0327013
Tubercle of right pinna,fma.fma61152
Salpingopharyngeal fold,fma.fma54987
Epidural space,fma.fma321643
Subdural space of basal region of brain,fma.fma321643
Posterior cerebral artery,fma.fma50583
Osseous external acoustic tube,fma.fma61290
Plexiform layer of occipital lobe,fma.fma242495
White matter of right precuneus,fma.fma271700
Hilum of inferior olivary complex,fma.fma72612
Trunk of mammary tributary of internal thoracic vein,fma.fma78173
Alveolodental segment 14,fma.fma289759
Right medial frontal gyrus,fma.fma273105
Wall of trunk of posterior spinal artery,fma.fma85661
Muscle body of muscle of head,fma.fma319788
Cavity of left side of internal nose,fma.fma59730
Mucosa of right pharyngotympanic tube,fma.fma60110
Medial part of body of right zygomatic bone,fma.fma319217
Vermilion of philtrum,fma.fma305942
Gray matter of precentral gyrus,fma.fma270492
Right internal ear,fma.fma61020
Proximal tendon of antitragicus,fma.fma319692
Tubercle of left pinna,fma.fma61153
Parietal zone of scalp,fma.fma224012
Tributary of occipital emissary vein,fma.fma0327014
Neuroglial network of segment of brain,fma.fma268492
Basilar part of occipital bone,fma.fma52858
Right lesser palatine artery,fma.fma49802
Right stylomandibular ligament,fma.fma57084
Skin of orbital part of face,fma.fma59350
Anterior part of left inferior nasal concha,fma.fma57598
Predorsal bundle,fma.fma72614
Left mastoid foramen,fma.fma56098
Tragus,fma.fma60998
Subdivision of head,fma.fma24218
Subdivision of brachiocephalic vein,fma.fma77883
Muscular branch of inferior labial artery,fma.fma296685
Mucosa of oral segment of palate,fma.fma59765
Mucosa of frontal sinus,fma.fma59774
Retropharyngeal space of head,fma.fma84965
Soft palate,fma.fma55021
Cavernous branch of right internal carotid artery to right trigeminal ganglion,fma.fma49860
Alar part of left nasalis,fma.fma55615
Fat body,fma.fma58616
Brodmann area 23 of cuneus,fma.fma273392
Bony part of left stapes,fma.fma64011
Cortex of right parietal lobe,fma.fma242215
Right lateral inferior limiting sulcus,fma.fma275429
Right collicular artery,fma.fma50666
Parotid recess,fma.fma50666
Left basilar sulcus,fma.fma275475
Superficial fascia of parotid part of face,fma.fma284894
Proximal tendon of deep part of left masseter,fma.fma318841
Proximal lateral striate branch of middle cerebral artery,fma.fma50385
Brodmann area 8 of right medial frontal gyrus,fma.fma273472
Tributary of superficial middle cerebral vein,fma.fma0327009
Ascending pharyngeal artery,fma.fma49497
Gray matter of left posterior orbital gyrus,fma.fma270520
Right posterior communicating artery,fma.fma50085
Alveolodental segment 32,fma.fma289795
Trunk of dorsal scapular vein,fma.fma66693
Integument of left temporal part proper of head,fma.fma317819
Head of antitragicus,fma.fma320900
Cricothyroid artery,fma.fma49483
Right lateral pterygoid,fma.fma49016
Cortex of right lens,fma.fma58974
Superficial fascia of right side of face,fma.fma225810
Right vitreous body,fma.fma58828
External jugular vein,fma.fma13110
Root of right pterygoid process,fma.fma54875
Bony part of lacrimal bone,fma.fma259741
Distal tendon of superficial part of masseter,fma.fma318828
Body of left incus,fma.fma270025
Right lens,fma.fma58242
Habenula,fma.fma62032
Lateral crus of right major alar cartilage,fma.fma59572
Proximal tendon of superficial part of left masseter,fma.fma318823
Vasculature of frontal part of head,fma.fma270063
Anterior limb of left stapes,fma.fma270005
Polar part of right superior frontal gyrus,fma.fma72760
Periosteum of parietal bone,fma.fma234995
Right inferior hypophyseal artery,fma.fma49847
Medial surface of right auricular cartilage,fma.fma61100
Sella turcica,fma.fma54709
Trunk of right eighth anterior intercostal vein,fma.fma78157
Left lingual artery,fma.fma49528
Dorsal median sulcus of medulla oblongata,fma.fma83795
Anterior pontomesencephalic vein,fma.fma323255
Brodmann area 43 of right precentral gyrus,fma.fma271583
Callosal sulcus,fma.fma83743
Lumen of trunk of external carotid artery,fma.fma262119
Right sublingual vein,fma.fma50837
Trunk of branch of external carotid artery,fma.fma72138
Left posterior transverse temporal gyrus,fma.fma72694
Brodmann area 13 of left inferior frontal gyrus,fma.fma271423
Left temporal fossa compartment,fma.fma314586
Vermilion border region of upper lip,fma.fma286142
Brodmann area 6 of left medial frontal gyrus,fma.fma273462
Right paracentral sulcus,fma.fma275339
Gray matter of right precuneus,fma.fma271688
Right superior frontal sulcus,fma.fma275295
Interpeduncular vein,fma.fma51339
Cutaneous branch of transverse facial artery,fma.fma77980
Anterior intercostal vein,fma.fma12831
Right pupil,fma.fma58253
Right side of face,fma.fma54546
Right posterior medial choroidal artery,fma.fma50672
Right deep auricular artery,fma.fma49690
Superficial fascia of left parietal part of head,fma.fma86600
Subdivision of superior systemic venous tree,fma.fma78048
Trunk of tributary of subclavian vein,fma.fma77885
Right anterior clinoid process,fma.fma54694
Nasomaxillary part of face,fma.fma0329052
Ethmoidal process of left inferior nasal concha,fma.fma54744
Trunk of right uncal artery,fma.fma76193
Mucosa of palate,fma.fma289593
Mucosa of left vocal fold,fma.fma64083
Posterior commissure,fma.fma62072
Pallidotegmental fasciculus,fma.fma72458
Right sphenoidal lingula,fma.fma54758
Premarginal recess of Eisler,fma.fma0327411
Right supratragic tubercle,fma.fma228619
Tentorial basal branch of left internal carotid artery,fma.fma70533
Peridental branch of inferior alveolar artery,fma.fma49700
Suprachoroid lamina,fma.fma58368
Left frontal sinus,fma.fma57419
Mandibular gingiva,fma.fma59764
Muscle body of left occipitalis,fma.fma318368
Right middle temporal gyrus,fma.fma72685
Skeletal muscle tissue of right temporoparietalis,fma.fma318384
Left masseter,fma.fma48998
Telodiencephalic fissure,fma.fma83726
Deep part of right submandibular gland,fma.fma59947
Distal lateral striate branch of left middle cerebral artery,fma.fma50390
Vasculature of left maxilla,fma.fma259854
Meningeal space of spinal cord,fma.fma259854
Vasculature of periosteum of zygomatic bone,fma.fma315517
Right zygomatic arch,fma.fma53121
Alveolodental segment 1,fma.fma289733
Major arterial circle of iris,fma.fma58529
Tributary of inferior sagittal sinus from cingulum,fma.fma85137
Left stylomastoid artery,fma.fma49630
Muscle body of superior tarsal muscle,fma.fma318624
Left stapes,fma.fma74049
Musculature of subdivision of mouth,fma.fma289612
Subarachnoid sulcus,fma.fma75759
Cranial sinus space,fma.fma314945
Right inferior temporal sulcus,fma.fma275425
Periosteum of zygomatic bone,fma.fma259823
Right anterior deep temporal artery,fma.fma49747
Left superior transverse frontopolar gyrus,fma.fma274412
Right lateral palpebral commissure,fma.fma59317
Left transverse occipital sulcus,fma.fma275443
Brodmann area 45 of left inferior frontal gyrus,fma.fma271488
Wall of bony part of right pharyngotympanic tube,fma.fma60076
Lumen of nasolacrimal duct,fma.fma59722
Vitreous chamber of eyeball,fma.fma58848
Transverse part of left nasalis,fma.fma55613
Right sublingual gland,fma.fma59804
Systemic arterial tree of female human body,fma.fma269096
Right inferior labial artery,fma.fma49568
Wall of trunk of right posterior spinal artery,fma.fma262421
Superior zone of orbicularis oris,fma.fma46845
Tributary of pterygoid plexus,fma.fma50945
Zone of longitudinal fissure,fma.fma284459
Integument of columella,fma.fma224104
Right mastoid part of head,fma.fma61723
Segment of ventricular system of brain,fma.fma78447
Right ala of vomer,fma.fma57675
Left occipital artery,fma.fma49588
Carotid siphon,fma.fma50109
Trunk of supra-orbital vein,fma.fma316914
Left temporal part of leptomeningeal sac,fma.fma318231
White matter of left medial orbital gyrus,fma.fma270969
Muscle body of right orbitalis,fma.fma318722
Right eleventh anterior intercostal vein,fma.fma71207
Vestibular fold,fma.fma55452
Lateral branch of left superior cerebellar artery,fma.fma50579
Left sphenoidal concha,fma.fma54735
Subdural space of segment of brain,fma.fma0326172
Branch of left anterior choroidal artery to left lateral ventricle,fma.fma50132
Left lateral ventricle,fma.fma78450
Gray matter of right superior frontal gyrus,fma.fma270480
Choroidal branch of posterior inferior cerebellar artery to fourth ventricle,fma.fma50528
First posterior intercostal vein,fma.fma4744
Occipital part of leptomeningeal sac,fma.fma318233
Angular vein,fma.fma50893
Vasculature of endosteum of left lacrimal bone,fma.fma315469
Gray matter of midbrain,fma.fma83913
Middle thyroid vein,fma.fma50823
Brodmann area 9 of left precentral gyrus,fma.fma271732
Left primary motor cortex,fma.fma242635
Right side of upper jaw,fma.fma54553
Mucosa of left side of nasal septum,fma.fma60115
Synovial membrane of articular capsule of left temporomandibular joint,fma.fma57056
Left anterior orbital gyrus,fma.fma256200
Subarchnoid space of occipital region,fma.fma0327216
Zygomaticomaxillary suture,fma.fma52953
Left third upper molar tooth bony socket,fma.fma269689
Occipital diploic vein,fma.fma50789
Pseudostratified ciliated columnar epithelium,fma.fma13146
Left anterior tympanic artery,fma.fma49694
Right lateral lacuna,fma.fma52208
Side of face,fma.fma0326568
Cavity of right conjunctival sac,fma.fma59084
Ventral part of of right lateral occipital gyrus,fma.fma274245
Right infratemporal crest,fma.fma54794
Vasculature of endosteum of right parietal bone,fma.fma315453
Mandibular dental arcade,fma.fma55635
Right anterior superior alveolar artery,fma.fma49772
Right occipitotemporal sulcus,fma.fma275291
Mucosa of retromolar region,fma.fma313912
Articular cartilage of posterior part of zygomatic process of left temporal bone,fma.fma57098
Dentition,fma.fma75150
Medial branch of superior cerebellar artery,fma.fma50580
Anterior cerebellar incisure,fma.fma74524
Left paracentral sulcus,fma.fma275341
Prevertebral part of right vertebral artery,fma.fma50497
Trunk of esophageal vein,fma.fma66701
